<!ELEMENT disciplinas (disciplina+)>
<!ELEMENT disciplina (codigo,nome,carga,ementa,semestre,curso)>
<!ATTLIST disciplina id CDATA #IMPLIED>
<!ELEMENT codigo (#PCDATA)>
<!ELEMENT nome (#PCDATA)>
<!ELEMENT carga (#PCDATA)>
<!ELEMENT ementa (#PCDATA)>
<!ELEMENT semestre (#PCDATA)>
<!ELEMENT curso (#PCDATA)>